{
  "cold_measurement_format": 1,
  "measurement_id": "m8e.pilot.cold.typescript.00",
  "schedule_id": "pilot.cold.typescript.00",
  "campaign_id": "m8e-non-official-pilot",
  "configuration_id": "m8-agent-experiment-v1",
  "language": "typescript",
  "official": "no",
  "round": 0,
  "status": "included",
  "exclusion_reason": "",
  "environment_sha256": "e10a9d3c70aca26c3132e2fdc4361eddff397d18bd92a42065b7977194ff8b10",
  "package_manifest_path": "artifacts/cold-typescript-package.json",
  "package_manifest_sha256": "d46aaccb046ace9b24a6caf329eea6dcf3fe420e7cfb429e456f1160ce399fb1",
  "dependency_lock_sha256": "abb5831a57b46e68648a55b41a08a990ac8fd9af6fb707cd52b3590caddee894",
  "clock": {
    "source": "time.perf_counter_ns",
    "unit": "nanosecond",
    "monotonic": "yes"
  },
  "affinity": {
    "policy": "single-sequential-unbound",
    "binding_supported": "no",
    "logical_cpu_count": 8
  },
  "load": {
    "before": {
      "available": "yes",
      "one_minute_milli": 3735,
      "five_minute_milli": 5353,
      "fifteen_minute_milli": 4914
    },
    "after": {
      "available": "yes",
      "one_minute_milli": 3735,
      "five_minute_milli": 5353,
      "fifteen_minute_milli": 4914
    }
  },
  "readiness_signal": "jsonl-ready-v1",
  "process_creation_ns": 1716375,
  "readiness_ns": 43519750,
  "idle_rss_bytes": 41893888,
  "peak_rss_bytes": 58834944,
  "exit_status": 0,
  "external_access_attempts": 0,
  "corpus": {
    "manifest_sha256": "33b8369ca3680367b5371811ce52ef639a878696698f70765def0f6c9e8c1eb5",
    "case_count": 37,
    "elapsed_ns": 2311666,
    "status": "passed",
    "trace": "passed",
    "external_access_monitor": "sandbox-exec-deny-report+proc-pidtaskinfo"
  }
}
